{
  "baselinesSha256": "18c06ef9ad41f06f6dc20219fb46ea1393f2d0d82800d21ba06e4cd52a0175f3",
  "edges": [
    {
      "consumerManifest": "core/package.json",
      "declaredSpec": "^2.6.3",
      "evidence": {
        "path": "migration/control-evidence/n00/inventory.json",
        "sha256": "394ee8543ef2c98c46a4c17513fde9e6976139e3be2e3acf855643d950cd5c12"
      },
      "expectedOrigin": "workspace:tools/publish-scripts/package.json",
      "expectedVersion": "2.8.0",
      "finalSpec": "^2.6.3",
      "id": "edge-core-devdependencies-uirouter-publish-scripts",
      "manifestSection": "devDependencies",
      "owningLane": "published-package:core",
      "package": "@uirouter/publish-scripts",
      "packedExpectation": "local-tarball",
      "resolutionMode": "workspace"
    },
    {
      "consumerManifest": "core/integration/typescript-3.9/package.json",
      "declaredSpec": "latest",
      "evidence": {
        "path": "migration/control-evidence/n00/inventory.json",
        "sha256": "394ee8543ef2c98c46a4c17513fde9e6976139e3be2e3acf855643d950cd5c12"
      },
      "expectedOrigin": "packed-artifact:@uirouter/core@6.1.2",
      "expectedVersion": "6.1.2",
      "finalSpec": "artifact:@uirouter/core@6.1.2",
      "id": "edge-core-integration-typescript-3-9-dependencies-uirouter-core",
      "manifestSection": "dependencies",
      "owningLane": "integration:core/integration/typescript-3.9",
      "package": "@uirouter/core",
      "packedExpectation": "local-tarball",
      "resolutionMode": "local-tarball"
    },
    {
      "consumerManifest": "core/integration/typescript-3.9/package.json",
      "declaredSpec": null,
      "evidence": {
        "path": "migration/control-evidence/n00/inventory.json",
        "sha256": "394ee8543ef2c98c46a4c17513fde9e6976139e3be2e3acf855643d950cd5c12"
      },
      "expectedOrigin": "packed-artifact:@uirouter/core@6.1.2",
      "expectedVersion": "6.1.2",
      "finalSpec": "artifact:@uirouter/core@6.1.2",
      "id": "edge-core-integration-typescript-3-9-legacy-injected-uirouter-core-other-typescript3-9",
      "manifestSection": "legacy-injected",
      "owningLane": "integration:core/integration/typescript-3.9",
      "package": "@uirouter/core",
      "packedExpectation": "local-tarball",
      "resolutionMode": "local-tarball"
    },
    {
      "consumerManifest": "core/integration/typescript-5.4/package.json",
      "declaredSpec": "latest",
      "evidence": {
        "path": "migration/control-evidence/n00/inventory.json",
        "sha256": "394ee8543ef2c98c46a4c17513fde9e6976139e3be2e3acf855643d950cd5c12"
      },
      "expectedOrigin": "packed-artifact:@uirouter/core@6.1.2",
      "expectedVersion": "6.1.2",
      "finalSpec": "artifact:@uirouter/core@6.1.2",
      "id": "edge-core-integration-typescript-5-4-dependencies-uirouter-core",
      "manifestSection": "dependencies",
      "owningLane": "integration:core/integration/typescript-5.4",
      "package": "@uirouter/core",
      "packedExpectation": "local-tarball",
      "resolutionMode": "local-tarball"
    },
    {
      "consumerManifest": "core/integration/typescript-5.4/package.json",
      "declaredSpec": null,
      "evidence": {
        "path": "migration/control-evidence/n00/inventory.json",
        "sha256": "394ee8543ef2c98c46a4c17513fde9e6976139e3be2e3acf855643d950cd5c12"
      },
      "expectedOrigin": "packed-artifact:@uirouter/core@6.1.2",
      "expectedVersion": "6.1.2",
      "finalSpec": "artifact:@uirouter/core@6.1.2",
      "id": "edge-core-integration-typescript-5-4-legacy-injected-uirouter-core-other-typescript5-4",
      "manifestSection": "legacy-injected",
      "owningLane": "integration:core/integration/typescript-5.4",
      "package": "@uirouter/core",
      "packedExpectation": "local-tarball",
      "resolutionMode": "local-tarball"
    },
    {
      "consumerManifest": "framework/angular/examples/sample-app/package.json",
      "declaredSpec": "^21.0.0",
      "evidence": {
        "path": "migration/control-evidence/n00/inventory.json",
        "sha256": "394ee8543ef2c98c46a4c17513fde9e6976139e3be2e3acf855643d950cd5c12"
      },
      "expectedOrigin": "workspace:framework/angular/router/package.json",
      "expectedVersion": "22.0.0",
      "finalSpec": "^22.0.0",
      "id": "edge-framework-angular-examples-sample-app-dependencies-uirouter-angular",
      "manifestSection": "dependencies",
      "owningLane": "example:framework/angular/examples/sample-app",
      "package": "@uirouter/angular",
      "packedExpectation": "local-tarball",
      "resolutionMode": "workspace"
    },
    {
      "consumerManifest": "framework/angular/examples/sample-app/package.json",
      "declaredSpec": "^6.1.2",
      "evidence": {
        "path": "migration/control-evidence/n00/inventory.json",
        "sha256": "394ee8543ef2c98c46a4c17513fde9e6976139e3be2e3acf855643d950cd5c12"
      },
      "expectedOrigin": "workspace:core/package.json",
      "expectedVersion": "6.1.2",
      "finalSpec": "^6.1.2",
      "id": "edge-framework-angular-examples-sample-app-dependencies-uirouter-core",
      "manifestSection": "dependencies",
      "owningLane": "example:framework/angular/examples/sample-app",
      "package": "@uirouter/core",
      "packedExpectation": "local-tarball",
      "resolutionMode": "workspace"
    },
    {
      "consumerManifest": "framework/angular/examples/sample-app/package.json",
      "declaredSpec": "^1.0.0",
      "evidence": {
        "path": "migration/control-evidence/n00/inventory.json",
        "sha256": "394ee8543ef2c98c46a4c17513fde9e6976139e3be2e3acf855643d950cd5c12"
      },
      "expectedOrigin": "workspace:plugins/rx/package.json",
      "expectedVersion": "1.0.0",
      "finalSpec": "^1.0.0",
      "id": "edge-framework-angular-examples-sample-app-dependencies-uirouter-rx",
      "manifestSection": "dependencies",
      "owningLane": "example:framework/angular/examples/sample-app",
      "package": "@uirouter/rx",
      "packedExpectation": "local-tarball",
      "resolutionMode": "workspace"
    },
    {
      "consumerManifest": "framework/angular/examples/sample-app/package.json",
      "declaredSpec": "^7.2.1",
      "evidence": {
        "path": "migration/control-evidence/n00/inventory.json",
        "sha256": "394ee8543ef2c98c46a4c17513fde9e6976139e3be2e3acf855643d950cd5c12"
      },
      "expectedOrigin": "workspace:plugins/visualizer/package.json",
      "expectedVersion": "7.2.1",
      "finalSpec": "^7.2.1",
      "id": "edge-framework-angular-examples-sample-app-dependencies-uirouter-visualizer",
      "manifestSection": "dependencies",
      "owningLane": "example:framework/angular/examples/sample-app",
      "package": "@uirouter/visualizer",
      "packedExpectation": "local-tarball",
      "resolutionMode": "workspace"
    },
    {
      "consumerManifest": "framework/angular/examples/sample-app/package.json",
      "declaredSpec": null,
      "evidence": {
        "path": "migration/control-evidence/n00/inventory.json",
        "sha256": "394ee8543ef2c98c46a4c17513fde9e6976139e3be2e3acf855643d950cd5c12"
      },
      "expectedOrigin": "workspace:framework/angular/router/package.json",
      "expectedVersion": "22.0.0",
      "finalSpec": "^22.0.0",
      "id": "edge-framework-angular-examples-sample-app-legacy-injected-uirouter-angular-default-sample-app-angular",
      "manifestSection": "legacy-injected",
      "owningLane": "example:framework/angular/examples/sample-app",
      "package": "@uirouter/angular",
      "packedExpectation": "local-tarball",
      "resolutionMode": "workspace"
    },
    {
      "consumerManifest": "framework/angular-hybrid/examples/example/package.json",
      "declaredSpec": "^22.0.0",
      "evidence": {
        "path": "migration/control-evidence/n00/inventory.json",
        "sha256": "394ee8543ef2c98c46a4c17513fde9e6976139e3be2e3acf855643d950cd5c12"
      },
      "expectedOrigin": "workspace:framework/angular/router/package.json",
      "expectedVersion": "22.0.0",
      "finalSpec": "^22.0.0",
      "id": "edge-framework-angular-hybrid-examples-example-dependencies-uirouter-angular",
      "manifestSection": "dependencies",
      "owningLane": "example:framework/angular-hybrid/examples/example",
      "package": "@uirouter/angular",
      "packedExpectation": "local-tarball",
      "resolutionMode": "workspace"
    },
    {
      "consumerManifest": "framework/angular-hybrid/examples/example/package.json",
      "declaredSpec": "latest",
      "evidence": {
        "path": "migration/control-evidence/n00/inventory.json",
        "sha256": "394ee8543ef2c98c46a4c17513fde9e6976139e3be2e3acf855643d950cd5c12"
      },
      "expectedOrigin": "workspace:framework/angular-hybrid/router/package.json",
      "expectedVersion": "22.0.0",
      "finalSpec": "^22.0.0",
      "id": "edge-framework-angular-hybrid-examples-example-dependencies-uirouter-angular-hybrid",
      "manifestSection": "dependencies",
      "owningLane": "example:framework/angular-hybrid/examples/example",
      "package": "@uirouter/angular-hybrid",
      "packedExpectation": "local-tarball",
      "resolutionMode": "workspace"
    },
    {
      "consumerManifest": "framework/angular-hybrid/examples/example/package.json",
      "declaredSpec": "1.1.1",
      "evidence": {
        "path": "migration/control-evidence/n00/inventory.json",
        "sha256": "394ee8543ef2c98c46a4c17513fde9e6976139e3be2e3acf855643d950cd5c12"
      },
      "expectedOrigin": "workspace:framework/angularjs/router/package.json",
      "expectedVersion": "1.1.2",
      "finalSpec": "1.1.1",
      "id": "edge-framework-angular-hybrid-examples-example-dependencies-uirouter-angularjs",
      "manifestSection": "dependencies",
      "owningLane": "example:framework/angular-hybrid/examples/example",
      "package": "@uirouter/angularjs",
      "packedExpectation": "local-tarball",
      "resolutionMode": "workspace"
    },
    {